761,2022/09/26,,yes,offline,,group demonstration,Xinjiang,Ili Kazakh Autonomous Prefecture,10-99,,,,COVID-19 pandemic policies,urban residents,local government,policy change,monitoring,,,,Tier 1,,"Residents of “Yinchengjiayuan” residential area in Yining City were dissatisfied with the long-term epidemic prevention and lockdown policy, so they protested on the street and demanded restrictions be lifted."
760,2022/09/26,,no,offline,,group demonstration,Xinjiang,Urumqi,100-999,,,,COVID-19 pandemic policies,urban residents,local government,policy change,monitoring,policy changed,,,Tier 1,,"After 47 days of lockdown, residents of Wangjialiang residential area in Urumqi protested and demanded that the lockdown be lifted. The authorities eventually agreed to lift the lockdown."
759,2022/09/02,,no,offline,,group demonstration,Hubei,Wuhan,100-999,,,,COVID-19 pandemic policies,urban residents,local government,policy change,monitoring,government received/responded,,,Tier 1,,"Residents of the Panlongcheng residential area in Wuhan protested collectively and demanded that the lockdown be lifted. Later, a government officer promised that they would arrange an on-site inspection the next day, and if the conditions were met, the lockdown would be lifted."
758,2022/09/10,,yes,offline,,group demonstration,Guangdong,Shenzhen,100-999,,,,COVID-19 pandemic policies,urban residents,local government,policy change,,,,,Tier 1,,"Residents of a residential area in Shenzhen were dissatisfied with the long-term lockdown, so they protested collectively on the street. Many government personnel lined up on the street, seemingly trying to prevent people from leaving."
757,2022/09/13,,yes,offline,,group demonstration,Guangxi,Nanning,100-999,,,,"land rights, project plan violation",property owners,local government,policy change,"monitoring, arrest/detention",,,,Tier 1,,"Ronghe Banshan Mansion in Nanning was ordered by the local government to open the roads of the community to nearby kindergartens. Homeowners protested collectively, fearing that the opening of the road would create safety concerns. There were a large number of armed police at the scene to maintain stability. Some owners were allegedly arrested."
756,2022/09/03,,yes,offline,,collective sound protest,Jiangxi,Yingtan,10-99,,,,COVID-19 pandemic policies,urban residents,local government,policy change,,,,,Tier 1,,"Residents of the Evergrande Oasis residential area in Yingtan City have been quarantined for nearly a month. The residents therefore knocked on the pot collectively and shouted ""I need living supplies""."
755,2022/07/30,,no,offline,,spreading religious belief,Liaoning,Fushun,2--9,,,,freedom of belief,Falun Gong,,right to practice faith,arrest/detention,,,,Tier 1,,"Three Fushun Falun Gong practitioners, Zhang Guiping, Zhu Zhongdai, and Jiang Yongsheng, were arrested by the local police for hanging a ""Falun Dafa is Good"" slogan made of CDs on the side of the road."
754,2022/08/05,,no,offline,,spreading religious belief,Shandong,Linyi,1,,,female,freedom of belief,Falun Gong,,right to practice faith,arrest/detention,,,,Tier 1,,Linyi Falun Gong practitioner Li Chuanfang was arrested and detained by the police for distributing Falun Dafa materials to neighbors.
753,2022/07/25,,no,offline,,spreading religious belief,,Beijing,1,,,female,freedom of belief,Falun Gong,,right to practice faith,arrest/detention,,,,Tier 1,,"Beijing Falun Gong practitioner Zhao Shulan was arrested by the police and ordered to detain her for 15 days for distributing Falun Dafa materials in Yukou Area. Next day, the police instead ordered her to be ""released on bail"" because her physical examination did not meet the requirements."
752,2022/07/01,,yes,offline,,spreading religious belief,Heilongjiang,Harbin,2--9,,,,freedom of belief,Falun Gong,,right to practice faith,"harassment, intimidation",,,,Tier 1,,"Four Falun Gong practitioners in Shangzhi City were ""clarifying the truth"" from house to house in the city, and were then harassed and threatened by local police officers."
751,2022/07/07,,no,offline,,spreading religious belief,Heilongjiang,Harbin,1,,,,freedom of belief,Falun Gong,,right to practice faith,arrest/detention,,,,Tier 1,,"A Falun Gong practitioner in Harbin was ""clarifying the truth"" at a night market and then arrested by the local police station after being reported by the market administrator."
750,2022/07/02,,no,offline,,spreading religious belief,Heilongjiang,Harbin,1,,,,freedom of belief,Falun Gong,,right to practice faith,arrest/detention,,,,Tier 1,,"Harbin Falun Gong practitioner Fan Lijie was arrested by the Hongqi Police Station for ""clarifying the truth"" on the street, and was then illegally detained at the Harbin Yaziquan Detention Center. He or she was reportedly released after 17 days in custody."
749,2022/09/17,,yes,offline,,group demonstration,,Chongqing,10-99,,,,fraud,urban residents,automobile company,corporate accountability,,,,,Tier 1,,A group of consumers held up banner in front of a Tesla store in Chongqing to protest against the company's fraud.
748,2022/07/25,,no,offline,,lawsuit,Fujian,Ningde,1,,,,"corruption, abusing authority",urban residents,local government,"government accountability, compensation",,,,,Tier 1,,"A citizen of Ningde City filed a lawsuit to the court, demanding that the police and the secretary of the municipal legal committee who abused their power to commit violence against him should be held accountable, and that the government should compensate him."
747,2022/07/11,,yes,offline,,group demonstration,Hubei,Wuhan,10-99,,,,delayed housing project,property buyers,property developer,corporate accountability,,,,,Tier 1,,"A group of homebuyers in Wuhan protested with slogans in a square, shouting ""We want a way home."""
746,2022/09/14,,yes,offline,,one-person demonstration,Guangdong,Guangzhou,1,,,,pay and benefits,construction workers,property developer,payment of arrears,,,,,Tier 1,,A construction worker in Guangzhou threatened to commit suicide on the rooftop of China Merchants City's home project in order to demand wages.
745,2022/06/28,,yes,offline,,group demonstration,Shandong,Jinan,100-999,,,,school district disputes,property buyers,"local government, property developer","government accountability, corporate accountability",,,,,Tier 1,,"Homebuyers of the Jinan Junmao Mansion project gathered in front of the local education bureau to protest the injustice of the school district.  The developer advertised the construction of a primary school to attract buyers, promising that their children would have priority in schooling.  However, the local education bureau later announced that children from nearby areas would also be given priority in schooling, which caused dissatisfaction among the buyers of the Junmao Mansion project."
744,2022/09/22,,yes,offline,,group demonstration,Sichuan,Chengdu,10-99,,,,delayed housing project,property buyers,property developer,resume construction,,,,,Tier 1,,"Homebuyers of Chengdu Xiexin·Tianfeng Villa project held banner in front of the sales center to protest, demanding that the developer resume the project."
743,2022/09/22,,no,offline,,group demonstration,Shaanxi,Ankang,10-99,,,,delayed housing project,property buyers,property developer,property handover,,,,,Tier 1,,"Nearly 100 buyers of the Jinke Jimei County project in Ankang High-tech Zone gathered in front of the project site and held banners to protest. That day was originally scheduled to handover the house, but the developer repeatedly postponed the handover due to lack of funds"
742,2022/08/01,,yes,offline,,group demonstration,Guangdong,Maoming,10-99,,,,delayed housing project,property buyers,property developer,corporate accountability,,,,,Tier 1,,"Homebuyers of the ""Shanhuhai"" project in Maoming City held a banner in front of the reception center to protest against the developer's delayed handover."
741,2022/06/22,,yes,offline,,group demonstration,Henan,Zhoukou,2--9,,,,pay and benefits,construction workers,property developer,payment of arrears,,,,,Tier 1,,"In front of the ""JiMeiqingzhou"" project in Zhoukou City, dozens of construction workers held up banners to demand wages from the developer."
740,2022/09/19,,yes,offline,,group demonstration,Jiangsu,Wuxi,2--9,,,male,pay and benefits,construction workers,property developer,payment of arrears,,,,,Tier 1,,A group of construction workers in Wuxi City held up banners to demand wages from the Sunac Company.
739,2022/09/21,,yes,offline,,group demonstration,Guangxi,Nanning,10-99,,,male,fraud,investors,furniture company,return assets,,,,,Tier 1,,"A group of investors protested with banners outside Nanning Dajiahui Furniture Mall, demanding that a furniture company return their property."
738,2022/09/15,2022/09/17,no,offline,,"performance art, non-cooperation",Hebei,Zhangjiakou,2--9,,,male,COVID-19 pandemic policies,rural residents,local government,policy change,,policy changed,,,Tier 1,,"Two residents of Taipingbao Village in Zhangjiakou, successfully won the local government to compromise through performance art, allowing them not to undergo unnecessary COVID-19 PCR tests."
737,2022/07/31,,yes,offline,,group demonstration,Hubei,Wuhan,10-99,,,,fraud,property buyers,property developer,rescind contract,,,,,Tier 1,,"Homebuyers of the Blue Sky Garden project in Xiantao City, Wuhan, held up banners in front of the sales center to protest against the developer's false advertisement, which caused them to suffer losses. They demanded to terminate the contract."
736,2022/07/25,,no,offline,,group demonstration,Shaanxi,Xi'an,10-99,,,,pay and benefits,construction workers,property developer,payment of arrears,,,,,Tier 1,,"A group of construction workers held banner in front of the reception center of the Xi'an Greentown Ziwei Mansion project, demanding that the developer pay the long-overdue construction and material fees."
735,2022/06/21,,no,offline,,group demonstration,Sichuan,Chengdu,10-99,,,,project plan violation,property buyers,property developer,,,,,,Tier 1,,Homebuyers of Vanke Park Legend in Chengdu went to the developer's headquarters to protest with signs against the developer's false advertising and failure to follow the construction plan.
734,2022/09/20,,yes,offline,,collective petitioning,Shanxi,Luliang,10-99,,,,delayed housing project,property buyers,local government,,,,,,Tier 1,,"As the construction of Luliang Evergrande Mansion stalled for a long time, homebuyers went to the city hall to appeal to the authorities but were stopped by the security guards at the entrance."
733,2022/09/15,,yes,offline,,group demonstration,Shandong,Weifang,2--9,,,,school bullying,victim's family/friends,public school,school intervention,,,,,Tier 1,,"Weifang Shenglidong Primary School had a school bullying incident, and the parents of the student(s) held a banner on the roadside to plead with the school to actively deal with the school bullying."
732,2022/08/14,,yes,offline,,group demonstration,Fujian,Zhangzhou,2--9,,,,illegal property handover,property owners,property developer,provide certificates/documents,,,,,Tier 1,,"Homeowners of ""City Central Golden Plaza"" in Zhangzhou who bought their houses more than 10 years ago still couldn't get their property licenses, so they held a banner in front of the sales center to demand that the developer address this issue."
731,2022/08/13,,no,offline,,group demonstration,Henan,Zhengzhou,10-99,,,,delayed housing project,property buyers,local government,government intervention,arrest/detention,,,,Tier 1,,"As the project of ""Yuesan City"" in Zhengzhou stalled, homebuyers went to the sales center with banners asking the government to investigate the developer, and the poster said several people were detained by the police."
730,2022/08/31,,no,offline,,collective petitioning,Jiangsu,Nanjing,10-99,,,,delayed housing project,property buyers,local government,,monitoring,,,,Tier 1,,"As the construction of Nanjing Jiayuan Plaza had stalled, homebuyers protested with banners and went to the municipal government for help, but were stopped by police outside."
729,2022/10/15,,yes,offline,,group demonstration,Jiangxi,Ji'an,10-99,,,,delayed housing project,property buyers,property developer,"government intervention, resume construction",,,,mortgage default movement,Tier 1,,"Homebuyers of Ji'an Sanshui Literary Garden project went to the sales center to protest, demanding the developer resume construction. They also announced the suspension of mortgage repayment if the developer did not resume construction."
728,2022/10/12,,yes,offline,,group demonstration,Jiangsu,Xuzhou,2--9,,,,pay and benefits,steel industry workers,steel company,payment of arrears,,,,,Tier 1,,Several workers held banners at the gate of Xuzhou Xu Steel Group to demand wages.
727,2022/09/21,,no,offline,,lawsuit,Hubei,Ezhou,1,,,,verdict/sanction disputes,urban residents,local government,"revocation of sanction, compensation",,,,,Tier 1,,"A netizen in Hubei was detained by the Ezhou police for 15 days under the name of ""picking quarrels and provoking trouble"" after questioning ”who gave the township the power to illegally lockdown?"" on Weibo. The netizen then filed an administrative lawsuit, demanding that the punishment be revoked and that he should be compensated."
726,2022/10/12,,yes,offline,,lawsuit,,Chongqing,1,,,,COVID-19 pandemic policies,students,university,government accountability,,,,,Tier 1,,"A student at Southwest University of Political Science and Law in Chongqing filed a lawsuit against the school. According to the lawsuit documents, he sued the school because of the frequently change of the epedemic prevention policy, but the school required the plaintiff to bear the cost of off-campus accommodation."
725,2022/09/20,,yes,offline,,group demonstration,Henan,Zhoukou,10-99,,,,delayed housing project,property buyers,local government,property handover,,,,,Tier 1,,"As the construction of ""Hanfu Park One"" in Zhoukou had stalled, homebuyers held up banners in front of the city hall and demanded the property handover. According to the poster, the homebuyers were dispersed and banners confiscated."
724,2022/07/29,,yes,offline,,group demonstration,Jiangxi,Ruijin,10-99,,,,delayed housing project,property buyers,property developer,refund,,,,,Tier 1,,"Property buyers of Ruijin Agricultural and Sideline Products Trading Center accused the developer of failing to hand over the property as scheduled and held up banners in front of the project reception center, demanding refunds."
723,2022/09/10,,yes,offline,,group demonstration,Hubei,Wuhan,10-99,,,,property pricing,property buyers,property developer,,"monitoring, non-state violence",,,,Tier 1,,"Homebuyers of Wuhan Landsea Green held banners in the sales center to protest the developer's price cut on the property units. According to the poster, the developer's employees used violence against homebuyers while police were present."
722,2022/08/02,,yes,offline,,group demonstration,Shandong,Zaozhuang,10-99,,,,property management disputes,property owners,property management,replacing service provider,,,,,Tier 1,,"Homeowners of Daonanli in Zaozhuang had disputes with the property management company over the parking space ownership issue, accusing the company of blocking their cars from entering and demanding that the company be replaced. The video shows a police presence."
721,2022/07/08,,no,offline,,group demonstration,Hubei,Huanggang,10-99,,,,property management disputes,property owners,property management,corporate accountability,,,,,Tier 1,,"Homeowners of one residential complex in Macheng held a banner and signs to accuse the property management company of mismanagement that caused safety issues with drinking water. They demanded that the problems be solved, or the property management fees would not be paid."
720,2022/08/12,,yes,offline,,"petition, one-person demonstrationnon-cooperation",Shanxi,Taiyuan,1,,,,delayed housing project,property buyers,"local government, property developer","government intervention, corporate accountability","monitoring, movement limitations",,,,Tier 1,,"A homebuyer in Taiyuan was dissatisfied with the developer's delay in handing over the house for more than a year, so he went to the local government to petition. However, the police pulled him on a bus to prevent him from continuing to petition, and he refused to cooperate during the process."
719,2022/06/06,,yes,offline,,group demonstration,,Chongqing,10-99,,,,project plan violation,property owners,"local government, property developer","government intervention, corporate accountability",,,,,Tier 1,,"Chongqing Yinglong Trade City changed the project plan without the owner's consent. Therefore, property owners protested at the gate of the Chongqing Economic and Technological Development Zone Management Committee, asking the government to intervene."
718,2022/09/27,,yes,offline,,"group demonstration, sign protest",Shandong,Qingdao,10-99,,,,"fraud, building quality",property owners,"local government, property developer","government accountability, corporate accountability",monitoring,,,,Tier 1,,"Homebuyers of a project in Qingdao refused to receive the house due to the high proportion of public facilities, and gathered in front of the sales center to protest. A buyer wrote a slogan on a white T-shirt during the protest."
717,2022/09/26,,yes,offline,,group demonstration,Jilin,Changchun,10-99,,,,fraud,investors,financial company,return assets,,,,,Tier 1,,A group of lenders gathered outside Jieyue United Company in Changchun to protest against the company's fraud.
716,2022/10/13,,yes,offline,,sign protest,Shandong,Linyi,1,,,,pay and benefits,construction workers,property developer,payment of arrears,,,,,Tier 1,,Workers hung banners on the wall of the Mount Homeland project in Linyi City to demand wages from the developer.
715,2022/10/12,,yes,offline,,group demonstration,Hunan,Changsha,2--9,,,male,pay and benefits,E-commerce workers,E-commerce company,payment of arrears,,,,,Tier 1,,Employees of Changsha Xingsheng Selected E-Commerce Company went to the company and held banners to demand wages.
714,2022/09/07,,yes,offline,,group demonstration,Zhejiang,Wenzhou,10-99,,,,school bullying,urban residents,public school,government accountability,,,,,Tier 1,,"A student at Wenzhou Chant Garden Elementary School often bullied classmates, but the school did not properly solve the problem. Therefore, a group of parents held banners at the school gate to protest, asking the school to properly handle the matter."
713,2022/09/16,,yes,offline,,"group demonstration, sign protest",Hebei,Shijiazhuang,2--9,,,,school district disputes,urban residents,public school,government accountability,,,,,Tier 1,,"A group of parents held banner to protest in front of the No. 81 Middle School in Shijiazhuang City. According to the banner, they protested the school's policies that resulted in unfair class assignment, and demanded the original class assignment be revoked."
712,2022/10/11,,yes,offline,,group demonstration,Zhejiang,Ningbo,2--9,,,,occupational safety,victim's family/friends,machinery company,compensation,,,,,Tier 1,,"A worker at Ningbo Semboo Machinery Co., Ltd. died while loading the goods, but the person in charge of the company shied the responsibility. The family members went to the company to protest."
711,2022/09/13,,no,offline,,non-cooperation,Hainan,Danzhou,10-99,,,,land rights,rural residents,local government,,state violence,,,,Tier 1,,The land of a village in Danzhou City was expropriated by the local government. Violent clashes broke out with the villagers when the police forcibly entered the village. It can be seen from the video that some villagers were injured as a result.
710,2022/06/22,,yes,offline,,group demonstration,Guangdong,Dongguan,10-99,,,,land rights,rural residents,local government,return assets,,,,,Tier 1,,"The land of a village in Dongguan was expropriated. The villagers went to the local government to protest, shouting ""Return my land""."
709,2022/10/03,,yes,offline,,group demonstration,Jilin,Changchun,10-99,,,,"fraud, building quality",property owners,property developer,rescind contract,,,,,Tier 1,,"Homebuyers of the Changchun China Chic project went to the sales center to protest against the developer's false advertisement, and the quality of the project did not meet expectations. Therefore, they requested to rescind the contract."
708,2022/10/12,,yes,offline,,sign protest,Henan,Xinyang,1,,,,delayed housing project,property buyers,property developer,rescind contract,,,,,Tier 1,,Homebuyers hang banners in front of the Xinyang Linzhi Future City project site to protest the unfinished of the project.
707,2022/10/12,,yes,offline,,group demonstration,Hubei,Wuhan,10-99,,,,building quality,property owners,property developer,corporate accountability,monitoring,,,,Tier 1,,"On the first day of handover of the Wuhan Inner Peace project, a group of homebuyers protested at the entrance of the project. As can be seen from the photos, they listed a total of 10 building quality problems, and asked the developer to take responsibility for repairs."
706,2022/09/14,,yes,offline,,group demonstration,Shaanxi,Xi'an,10-99,,,,land rights,rural residents,local government,"government accountability, compensation",,government received/responded,,,Tier 1,,"Sanzhao Village in Xi'an was demolished, but the local government has delayed the payment of compensation. Therefore, the villagers went to the district management committee to demand compensation from the government. According to the Weibo photo, the committee seems to have sent representatives to meet them."
705,2022/09/29,,yes,offline,,group demonstration,Henan,Zhengzhou,10-99,,,,land rights,rural residents,local government,"government accountability, compensation",,,,,Tier 1,,"A village in Zhengzhou was demolished, but the local government has delayed the payment of compensation. Therefore, the villagers took to the streets to demand compensation from the government."
704,2022/10/08,,yes,offline,,group demonstration,Shaanxi,Xi'an,10-99,,,,land rights,rural residents,local government,,,,,,Tier 1,,Xiadian Village in Xi'an City was about to be demolished. The villagers went to the village committee to protest.
703,2022/09/11,,yes,offline,,one-person demonstration,Guangdong,Foshan,1,,,male,pay and benefits,furniture workers,furniture company,payment of arrears,,,,,Tier 1,,A worker at a furniture factory in Foshan threatened to jump off the factory roof after the company boss refused to paid three months of wage arrears.
702,2022/10/18,,yes,offline,,group demonstration,Shandong,Yantai,2--9,,,male,pay and benefits,technology workers,technology company,payment of arrears,non-state violence,,,,Tier 1,,"A technology company in Yantai owed wages, several workers held banner in front of the company to demand wages. One of the worker was beaten by the company personnel."
701,2022/09/01,,yes,offline,,strike,Gansu,Lanzhou,,,,,pay and benefits,transportation workers,transportation company,payment of arrears,,,,,Tier 3,,"Yunda workers in Lanzhou went on strike to protest eight months of unpaid wages, according to a Weibo post."
700,2022/09/08,,yes,offline,,group demonstration,Jiangsu,Suzhou,2--9,,,,pay and benefits,education workers,private educational institution,payment of arrears,,,,,Tier 1,,Employees of a music school in Suzhou protested in front of the company to demand wage arrears.
699,2022/09/07,,yes,offline,,group demonstration,Shandong,Linyi,10-99,,,,pay and benefits,construction workers,property developer,payment of arrears,,,,,Tier 1,,A group of migrant workers collectively demanded wage arrears in front of the construction site of the Tianyuan Tailu Shidai housing project.
698,2022/09/06,,no,offline,,"group demonstration, caravan",Hubei,Huangshi,100-999,,,,utility issues,transportation workers,gas station,fee reduction,,,,,Tier 1,,Taxi drivers collectively drove to a gas station in Yangxin county to protest a higher price for natural gas and demand the price be reduced.
697,2022/09/06,,yes,offline,,group demonstration,Shandong,Qingdao,2--9,,,,pay and benefits,construction workers,construction company,payment of arrears,,,,,Tier 1,,Several workers of Qingdao Qingcheng Construction collectively demanded wage arrears from the company.
696,2022/09/04,,yes,offline,,"group demonstration, strike",Hunan,Changsha,10-99,,,,pay and benefits,transportation workers,taxi company,rescind contract,,,"694, 695",,Tier 1,,"The subsidy policy of the ride-hailing platform T3 Go was inconsistent with the contract, resulting in less income for many taxi drivers. To this end, a group of drivers in Changsha parked their cars on the side of the road to strike and demanded the termination of the contract."
695,2022/09/02,,no,offline,,"group demonstration, strike",Zhejiang,Hangzhou,10-99,,,,pay and benefits,transportation workers,taxi company,rescind contract,,,"694, 696",,Tier 1,,"The subsidy policy of the ride-hailing platform T3 Go was inconsistent with the contract, resulting in less income for many taxi drivers. To this end, a group of drivers went to the company's headquarter in Hangzhou to demand the termination of the contract."
694,2022/09/01,,yes,offline,,strike,Sichuan,Chengdu,,,,,pay and benefits,transportation workers,taxi company,rescind contract,,,"695, 696",,Tier 3,,"According to a WeChat post, a large number of Chengdu T3 Go ride-hailing drivers were dissatisfied with the company's sunsidy policy and demanded the termination of their contracts."
