498,2022/09/03,,yes,offline,,group demonstration,,Chongqing,10-99,,,,property pricing,property buyers,property developer,,non-state violence,,,,Tier 1,,Homebuyers of Chongqing Toncci Xuefu accused the developer of cheating them into buying expensive property units and held up banners at the property sales center but were beaten by the security guards. The videos they uploaded to Douyin were all censored.
497,2022/09/07,,no,offline,,group demonstration,Hebei,Cangzhou,,,,,delayed housing project,property buyers,property developer,rescind contract,,,,,Tier 1,,"Construction of the Jiangshan Mansion project of Country Garden in Cangzhou City has been suspended for a year. Although the developer had promised to fully resume  the construction on August 30, it still suspended. Homebuyers went to the construction sites to protest as they worried that the projects could be unfinished."
496,2022/09/04,,yes,offline,,group demonstration,Henan,Zhengzhou,10-99,,,,"delayed housing project, building quality",property buyers,property developer,corporate accountability,,,,,Tier 1,,"Dissatisfied with the delay handover by the Henan Central China Company, as well as forcibly handing over the house when many equipment did not meet the standards, the buyers collectively went to the developer's headquarters to protest."
495,2022/08/29,,yes,offline,,group demonstration,Jiangsu,Nanjing,10-99,,,male,fraud,property buyers,property developer,corporate accountability,,,,,Tier 1,,"Dissatisfied that the design of the houses of the Riverside Real Mansion project was different from the advertised plan, a group of homebuyers protested with banners in front of the construction site."
494,2022/06/30,,no,offline,,group demonstration,Sichuan,Chengdu,2--9,,,,project plan violation,property buyers,property developer,rescind contract,,,,,Tier 1,,"Homebuyers of Chengdu Poly Light In Lake gathered in front of the residential complex, holding banners to protest against the use of inferior materials by the developer and its failure to follow the building plan, and demanding that the contract be rescinded."
493,2022/08/22,,no,online,WeChat,"popular post, joint letter",Hebei,Handan,,1,,male,political change,Communist Party members,central government,political change,"intimidation, monitoring",,,,Tier 1,,"Three long-time Communist Party members over the age of 70--Dong Hongyi, Ma Guihui, and Tian Qizhuang--jointly signed an open letter and posted it on WeChat. It called on the Party to revise its rules, remove the principle of ""the Party leads everything"", and prohibit leading cadres from cults of personality. The signatories were subsequently intimidated and monitored by police and state security personnel."
492,2022/09/02,,yes,offline,,group demonstration,Henan,Zhumadian,2--9,,,,delayed housing project,property buyers,property developer,,state violence,,,,Tier 1,,"As the construction of Zhumadian Fun World had stalled for eight months, the property buyers went to the project sales center to defend their rights but were later forcibly dragged away by the police."
491,2022/08/06,,no,offline,,group demonstration,Hebei,Langfang,10-99,,,,delayed housing project,property buyers,property developer,corporate accountability,,,150,,Tier 1,,"Even though the date of handover is approaching, the construction of the Yalan Park project in Dachang County has not resumed. Homebuyers went to the construction sites to protest as they worried that the projects could be unfinished."
490,2022/07/29,,yes,offline,,sign protest,Henan,Puyang,1,,,,property management disputes,property owners,property management,fee reduction,,,,,Tier 1,,"Homeowners in the Biguiyuan Fengxitai housing development in Taiqian County hung banners to protest the poor service and high fees of the property management company, demanding a fee reduction. Protest language included ""property managers avoid and leave issues unresolved, resolved not to pay fees"" and ""five-star service is complete nonsense""."
489,2022/07/26,,yes,offline,,collective petitioning,Shandong,Jinan,2--9,,,,delayed housing project,property buyers,"local government, property developer",,state violence,,,,Tier 1,,"As the project's construction stalled, and the property handover was delayed, homebuyers of Jinan Sunac Resort went to the local Municipal People's Government to appeal to the officials to step in and address the issues facing them, but one of the petitioners was dragged away by the police."
488,2022/08/04,,no,offline,,lawsuit,Hubei,Wuhan,1,,,male,land rights,property owners,local government,"government accountability, compensation",state violence,,,,Tier 1,,"Petitioner Tong Bin went to the Wuchang District Court to file a lawsuit against the Wuchang government for illegally confiscating land and destroying valuable property in 2020. Wen Bin was attacked by multiple state personnel outside of the court, leading to 5 broken ribs."
487,2022/06/16,,no,offline,,group demonstration,Sichuan,Chengdu,10-99,,,,fraud,property buyers,"property developer, property management",refund,,,,,Tier 1,,"A group of property buyers accused Chengdu Feda Property Limited of deceiving them with false advertisements into buying the lattice shops. They also accused its partner, Yulica Business Management Limited, of deceiving them into paying high administrative fees and stopping paying them rent for the shops they purchased. The property buyers held up banners in front of the shopping mall and demanded refunds."
486,2022/08/23,,yes,offline,,group demonstration,Hunan,Changsha,10-99,,,,building quality,property buyers,property developer,"corporate accountability, rescind contract",,government intervened,,,Tier 1,,Homebuyers of the Meixi Yuezhang housing project demonstrated in the sales center for the project because the side of the building was clearly not straight. A video shows that the local government intervened in the case and verbally confirmed the building did not meet construction standards and required correction. Homebuyers demanded to end the contract altogether.
485,2022/08/17,,yes,offline,,"group demonstration, march",Henan,Shangqiu,10-99,,,,delayed housing project,property buyers,property developer,corporate accountability,,,,,Tier 1,,"The construction of the Zhongnan International City project in Shangqiu City was suspended, therefore, homebuyers went to the local dispute prevention and resolution center to protest. Before that, they appeared to have marched in front of the project site."
484,2022/09/03,,yes,offline,,group demonstration,Henan,Zhengzhou,10-99,,,,delayed housing project,property buyers,property developer,corporate accountability,expulsion,,,,Tier 1,,"The Fortune Nine Mansion project in in Zhengzhou City has been suspended for a month. As a result, homebuyers went to the sales center and held banners to protest. They were expelled by police during the protest, according to the content of the Weibo post."
483,2022/06/22,,yes,offline,,one-person demonstration,Shaanxi,Xi'an,1,,,,freedom of belief,urban residents,central government,right to practice faith,,,,,Tier 1,,"An activist in Xi'an held placards with slogans in support of freedom of religious belief and expressed solidarity with Zhang Zhan, who was under house arrest for reporting on COVID-19."
482,2022/09/04,,yes,offline,,group demonstration,Guangxi,Liuzhou,10-99,,,,delayed housing project,property buyers,property developer,rescind contract,,,,mortgage default movement,Tier 1,,"Dissatisfied with the long-term suspension of a housing project of Sunac Development Company in Liuzhou, homebuyers went to the sales center to protest, and demanded that the contract with the developer be terminated."
481,2022/09/05,,no,offline,,obstruction,Henan,Luoyang,10-99,,,,land rights,urban residents,,compensation,,,,,Tier 1,,"A road blocking protest occurred at an intersection in Luoyang City. Based on the comments on the Weibo post, it is speculated that the protesters blocked the road in order to demand compensation for demolition."
480,2022/09/05,,no,offline,,non-cooperation,Shanxi,Linfen,1,,,,freedom of belief,Christians,local government,right to practice faith,,,,,Tier 1,,"On the morning of September 5, the Linfen Public Security Bureau summoned a Christian from the Covenant Home Church for interrogation, but she refused. The police went to her home at 7 p.m. that night and asked for her cooperation. Under pressure from her work unit, she finally went to the bureau for interrogation."
479,2022/06/26,,no,offline,,spreading religious belief,Sichuan,Chengdu,,,,,freedom of belief,Christians,,right to practice faith,intrusion,,,,Tier 1,,"The Early Rain Covenant Church in Chengdu, Sichuan was intruded by the police during a gathering."
478,2022/06/12,,yes,offline,,group demonstration,Yunnan,Zhaotong,10-99,,,,freedom of belief,Muslims,local government,right to practice faith,monitoring,,,,Tier 1,,"On June 11, the dome of the Baoshan Mosque in Buga Hui Township, Zhaotong City, Yunnan, was forcibly demolished by the local government. As a result, many Muslims gathered in front of the mosque to protest. Several of the protesters were injured by the police."
477,2022/08/31,,yes,offline,,obstruction,Liaoning,Shenyang,10-99,,,,illegal property handover,property buyers,property developer,,"expulsion, monitoring",,,,Tier 1,,"As the developer attempted to force the property handover illegally without completing the procedures and providing the required documents, homebuyers of Shenyang Causewan Bay blocked the road to protest. The poster says police were there monitoring the situation and dispersed the crowd later. Weibo censored the posts relating to the protest."
476,2022/08/31,,yes,offline,,group demonstration,Sichuan,Meishan,10-99,,,,delayed housing project,property buyers,property developer,corporate accountability,state violence,,,,Tier 1,,"As the developer failed to hand over the property as contracted, homebuyers of Meishan River Park City held up banners outside the project sales center to protest. The photo shows the presence of police, who, according to the poster, had beaten some homebuyers."
475,2022/08/31,,yes,offline,,group demonstration,Shandong,Qingdao,10-99,,,,delayed housing project,property buyers,"local government, property developer","corporate accountability, government intervention",state violence,,,,Tier 1,,"As the project's construction hadn't been resumed, homebuyers of Qingdao Sansheng International Coast held up banners outside the sales center to protest and demanded that the government step in and solve the issues. The banners were wrested away by police."
474,2022/08/30,,no,offline,,group demonstration,Sichuan,Dazhou,10-99,,,,delayed housing project,property buyers,"local government, property developer","corporate accountability, government intervention","state violence, arrest/detention",,,,Tier 1,,"As the project's construction had stalled, and the property was unable to be handed over as contracted, homebuyers of Dazhou Greenland City went to the local Municipal People's Government and demanded that the government step in and solve the issues, but they were not received by officials and instead arrested by the police."
473,2022/08/31,,yes,offline,,group demonstration,Gansu,Tianshui,10-99,,,,delayed housing project,property buyers,property developer,corporate accountability,,,,,Tier 1,,"As the developer delayed the property handover, homebuyers of Gangu Jiuding Jinxiumingyuan held up banners outside the project sales center to protest, demanding that the developer pay breach of contract damages for the overdue handover."
472,2022/08/02,,yes,offline,,group demonstration,Liaoning,Shenyang,100-999,,,,delayed housing project,property buyers,property developer,resume construction,,,,,Tier 1,,"As the project's construction had stalled for a long time, and the property could not be handed over as contracted, homebuyers of Shenyang Evergrande Xijiang Tianyue held placards at the project sales center to protest and demanded that the developer resume construction."
471,2022/08/23,,no,offline,,group demonstration,Sichuan,Chengdu,100-999,,,,property management disputes,property owners,property management,"corporate accountability, government intervention",state violence,government opened investigation,,,Tier 1,,"Property management of the Longyuewan community collected high parking fees and failed to fix various things in disrepair, so hundreds of homeowners protested in the street in reaction. Police on the scene used pepper spray against protesters. According to a Weibo post, some children were also pepper sprayed. Three days later, Shuangliu District Market Inspection Bureau announced it ordered the company to correct problems after an investigation."
470,2022/08/27,,yes,offline,,group demonstration,Guangdong,Shenzhen,10-99,,,,COVID-19 pandemic policies,urban residents,local government,policy change,,,,,Tier 1,,The residents of a residential area in Shenzhen were discontented with the COVID restrictions adopted by the local government and demanded that the restrictions be lifted.
469,2022/08/29,,yes,offline,,group demonstration,Guangdong,Foshan,10-99,,,,fraud,property buyers,property developer,"refund, rescind contract",,,,,Tier 1,,"Homebuyers of Foshan Vanke Aristocrat Treasure held up banners in front of the residential complex, accusing the developer of false advertising, fraud and failing to inform them of nearby NIMBY facilities like factories, and demanding that the developer rescind the contract and provide refunds. The post was soon censored."
468,2022/08/30,2022/09/01,no,online,Weibo,hashtag movement,,,,"10,000+","100,000,000+",,pay and benefits,netizens,agricultural company,payment of arrears,,arrears paid,467,,Tier 1,,"An agricultural and forestry company in Xi'an, Shaanxi defaulted on the land transfer fee to a farmer. When the farmer went to the company to ask for payment, he was ridiculed by several staff members. This scene was filmed and was fermented on Weibo. There were a lot of posts on Weibo with the hashtag #elderly being ridiculed in Lantian Shaanxi#. Under the pressure of public opinion, the company compromised and promised to repay the land transfer fee."
467,2022/08/30,,yes,offline,,one-person demonstration,Shaanxi,Xi'an,1,,,male,pay and benefits,farmers,agricultural company,payment of arrears,,arrears paid,468,,Tier 1,,"An agricultural and forestry company in Xi'an, Shaanxi defaulted on the land transfer fee to a farmer. When the farmer went to the company to ask for payment, he was ridiculed by several staff members. This scene was filmed and was fermented on Weibo. Under the pressure of public opinion, the company compromised and promised to repay the land transfer fee."
466,2022/08/23,,no,offline,,"group demonstration, collective petitioning",,Shanghai,10-99,,,,fraud,investors,real estate company,refund,"monitoring, state violence, arrest/detention, expulsion, intimidation",,,,Tier 1,,"Investors of Yango Group gathered in front of the Yango Holdings Building in Shanghai to protest and demanded that their hard-earned money be returned. The police cracked down on the protesters with violence and arrested some of them. Investors turned to the Shanghai Office for Letters and Calls for petitioning but did not get an official response. According to the interviewee, some investors were visited and intimidated by the police in the evening."
465,2022/09/04,,yes,offline,,sign protest,Liaoning,Shenyang,1,,,,pay and benefits,construction workers,property developer,payment of arrears,,,,,Tier 1,,"The developer of the Zhongliang Jinke Jiuxi project in Shenyang, Liaoning owed wages to construction workers. As a result, a group of workers hung banners on the project building to demand wages."
464,2022/09/03,,no,offline,,group demonstration,Zhejiang,Hangzhou,10-99,,,,fund withdrawal freeze,bank customers,"central government, bank","government intervention, access to deposits",monitoring,,463,Henan depositors movement,Tier 1,,"Depositors of Henan village banks held up banners outside a Hangzhou branch of the Bank of Nanjing, which acted as a clearing channel for funds for those village banks. They demanded that the banks return their deposits and appealed to the central government and President Xi Jinping to protect their rights. Police arrived to monitor the situation at the scene. Weibo censored most of the photos and videos of the protest."
463,2022/09/02,,no,offline,,group demonstration,Zhejiang,Hangzhou,100-999,,,,fund withdrawal freeze,bank customers,bank,access to deposits,monitoring,,464,Henan depositors movement,Tier 1,,"Depositors of Henan village banks held up placards and shouted ""Bank of Nanjing give my money back"" outside a Hangzhou branch of Bank of Nanjing, which acted as a clearing channel for funds for those village banks. A large troop of police officers arrived to maintain order at the scene. Weibo censored most of the photos and videos of the protest."
462,2022/08/22,,yes,offline,,sign protest,,Beijing,1,,,,COVID-19 pandemic policies,urban residents,"local government, central government",policy change,,,,,Tier 1,,"Dissatisfied with COVID-19 measures, one or more Beijing residents spray-painted words of protest on a PCR testing booth, including ""rather die than not be free"", ""idiotic pandemic controls"", and ""demolish""."
461,2022/08/21,,no,offline,,group demonstration,Shandong,Jiaozhou,2--9,,,,pay and benefits,construction workers,property developer,payment of arrears,monitoring,,,,Tier 1,,"The developer of Glory Mansion project in Jiaozhou, Guangdong owed wages to construction workers. Therefore, a group of workers went to the project site and held banners to demand wages."
460,2022/08/05,,yes,offline,,group demonstration,Guangdong,Zhuhai,10-99,,,,pay and benefits,construction workers,property developer,payment of arrears,,,,,Tier 1,,"The developer of Zhonghai Huanyu Tianxia project in Zhuhai, Guangdong owed wages to construction workers. Therefore, a group of workers went to the project site and held banners to demand wages."
459,2022/09/02,,yes,offline,,group demonstration,Guangdong,Huizhou,2--9,,,,pay and benefits,construction workers,property developer,payment of arrears,,,,,Tier 1,,"A group construction workers in Huizhou, Guangdong protested by climbing a 20-meter-long tower crane at the construction site in order to demand their salary."
458,2022/09/01,,yes,offline,,one-person demonstration,Hainan,Haikou,1,,,,pay and benefits,construction workers,property developer,payment of arrears,"arrest/detention, fine",,,,Tier 1,,"A construction worker in Haikou, Hainan protested by climbing a 20-meter-long tower crane at the construction site in order to demand his salary. After the incident, the worker was administratively detained for 10 days and fined 500 yuan."
457,2022/08/26,,yes,offline,,group demonstration,Zhejiang,Hangzhou,10-99,,,,building quality,property buyers,property developer,corporate accountability,,,,,Tier 1,,Homebuyers of the housing complex Humanities Mansion demonstrated outside of the project to protest poor building quality by the developer.
456,2022/06/28,,yes,offline,,sign protest,Hebei,Handan,1,,,,pay and benefits,construction workers,property developer,payment of arrears,,,,,Tier 1,,"MCC Jingcheng's steelmaking project in Handan, Hebei owed wages to construction workers, therefore, a group of workers hung banners at the construction site to demand wages."
455,2022/08/22,,yes,offline,,one-person demonstration,Jiangsu,Wuxi,1,,,male,pay and benefits,office workers,machinery company,payment of arrears,,arrears paid,,,Tier 1,,"An employee of Airtech in Wuxi posed in the nude with only placards covering his private parts to protest, as the company did not pay him his wages, and his social insurance fees were not paid either. According to the poster, the employee received the back payment on his wages after the protest."
454,2022/08/06,,yes,offline,,group demonstration,,Shanghai,10-99,,,,fraud,urban residents,private educational institution,"corporate accountability, refund",,,"445, 446, 447, 448, 449, 450, 451, 452, 453",,Tier 1,,"Mired in financial problems, the education company Kaikeba was unable to conduct online classes or provide obligated refunds. As a result, paying students in several locations around the country conducted street protests and demanded their money back."
453,2022/08/06,,yes,offline,,group demonstration,Hainan,Haikou,10-99,,,,fraud,urban residents,private educational institution,"corporate accountability, refund",,,"445, 446, 447, 448, 449, 450, 451, 452, 454",,Tier 1,,"Mired in financial problems, the education company Kaikeba was unable to conduct online classes or provide obligated refunds. As a result, paying students in several locations around the country conducted street protests and demanded their money back."
452,2022/08/06,,yes,offline,,group demonstration,Jilin,Jilin,10-99,,,,fraud,urban residents,private educational institution,"corporate accountability, refund",,,"445, 446, 447, 448, 449, 450, 451, 453, 454",,Tier 1,,"Mired in financial problems, the education company Kaikeba was unable to conduct online classes or provide obligated refunds. As a result, paying students in several locations around the country conducted street protests and demanded their money back."
451,2022/08/06,,yes,offline,,group demonstration,Jilin,Changchun,2--9,,,,fraud,urban residents,private educational institution,"corporate accountability, refund",,,"445, 446, 447, 448, 449, 450, 452, 453, 454",,Tier 1,,"Mired in financial problems, the education company Kaikeba was unable to conduct online classes or provide obligated refunds. As a result, paying students in several locations around the country conducted street protests and demanded their money back."
450,2022/08/06,,yes,offline,,group demonstration,Liaoning,Shenyang,10-99,,,,fraud,urban residents,private educational institution,"corporate accountability, refund",,,"445, 446, 447, 448, 449, 451, 452, 453, 454",,Tier 1,,"Mired in financial problems, the education company Kaikeba was unable to conduct online classes or provide obligated refunds. As a result, paying students in several locations around the country conducted street protests and demanded their money back."
449,2022/08/06,,yes,offline,,group demonstration,Hebei,Baoding,10-99,,,,fraud,urban residents,private educational institution,"corporate accountability, refund",,,"445, 446, 447, 448, 450, 451, 452, 453, 454",,Tier 1,,"Mired in financial problems, the education company Kaikeba was unable to conduct online classes or provide obligated refunds. As a result, paying students in several locations around the country conducted street protests and demanded their money back."
448,2022/08/06,,yes,offline,,group demonstration,Hebei,Shijiazhuang,10-99,,,,fraud,urban residents,private educational institution,"corporate accountability, refund",,,"445, 446, 447, 449, 450, 451, 452, 453, 454",,Tier 1,,"Mired in financial problems, the education company Kaikeba was unable to conduct online classes or provide obligated refunds. As a result, paying students in several locations around the country conducted street protests and demanded their money back."
447,2022/08/06,,yes,offline,,group demonstration,,Tianjin,2--9,,,,fraud,urban residents,private educational institution,"corporate accountability, refund",,,"445, 446, 448, 449, 450, 451, 452, 453, 454",,Tier 1,,"Mired in financial problems, the education company Kaikeba was unable to conduct online classes or provide obligated refunds. As a result, paying students in several locations around the country conducted street protests and demanded their money back."
446,2022/08/06,,yes,offline,,group demonstration,Heilongjiang,Harbin,10-99,,,,fraud,urban residents,private educational institution,"corporate accountability, refund",,,"445, 447, 448, 449, 450, 451, 452, 453, 454",,Tier 1,,"Mired in financial problems, the education company Kaikeba was unable to conduct online classes or provide obligated refunds. As a result, paying students in several locations around the country conducted street protests and demanded their money back."
445,2022/08/06,,yes,offline,,group demonstration,Guizhou,,10-99,,,,fraud,urban residents,private educational institution,"corporate accountability, refund",,,"446, 447, 448, 449, 450, 451, 452, 453, 454",,Tier 1,,"Mired in financial problems, the education company Kaikeba was unable to conduct online classes or provide obligated refunds. As a result, paying students in several locations around the country conducted street protests and demanded their money back."
444,2022/08/21,,no,offline,,group demonstration,Shandong,Jinan,10-99,,,,fraud,investors,local government,,,,,,Tier 1,,"Victims of the Ant Enterprise Services fraud held up banners at the Jinan Quancheng Square to protest, accusing the local government of collusion with the fraud ring and the authorities of dereliction and repressing victims."
443,2022/08/21,,no,offline,,group demonstration,Hubei,Wuhan,10-99,,,,property management disputes,property owners,property management,,state violence,,,,Tier 1,,"The property management company of Vanke Poly Ideal City charges the property owners overly high parking fees, which led to the protest of property owners wearing vests with printed protest slogans in front of the project sales center. A poster said that police used violence against the protesters and took some of them away."
442,2022/08/16,,no,offline,,group demonstration,Jiangxi,Jiujiang,10-99,,,male,pay and benefits,construction workers,property developer,payment of arrears,,,,,Tier 1,,"A developer of a project in Xiushui County, Jiangsu owed wages to construction workers. Therefore, a group of workers went to the construction site and held banners to demand wages."
